{
  "schema_version": 1,
  "id": "f88d7a711396",
  "title": "匀强磁场中的滑动导体杆：向右切割",
  "owner": "演示账号",
  "status": "pending_review",
  "source_input_type": "image",
  "physics_summary": {
    "topic": "匀强磁场中的滑动导体杆",
    "parameters": {
      "B_T": 0.35,
      "L_m": 1.5,
      "v_m_s": 5.0,
      "R_ohm": 0.75
    },
    "magnetic_direction": "垂直纸面向里",
    "motion_direction": "向右",
    "current_direction": "d → c（沿棒向上）",
    "asks": [
      "求电动势",
      "求电流",
      "求安培力",
      "说明能量转化关系"
    ]
  },
  "generated_at": "2026-07-28T09:24:15.600103+00:00",
  "path": "generator/staging/f88d7a711396/",
  "review": {
    "reviewer": "待课件验收",
    "reviewed_at": null,
    "physics_confirmed": false
  }
}
