{
  "schema_version": 1,
  "id": "23ba32d45ed2",
  "title": "匀强磁场中的滑动导体杆：向左切割",
  "owner": "演示账号",
  "status": "pending_review",
  "source_input_type": "image",
  "physics_summary": {
    "topic": "匀强磁场中的滑动导体杆",
    "parameters": {
      "B_T": 1.2,
      "L_m": 0.8,
      "v_m_s": 1.5,
      "R_ohm": 0.6
    },
    "magnetic_direction": "垂直纸面向外",
    "motion_direction": "向左",
    "current_direction": "d → c（沿棒向上）",
    "asks": [
      "判断感应电流方向",
      "求电阻的焦耳功率"
    ]
  },
  "generated_at": "2026-07-28T09:24:05.059560+00:00",
  "path": "generator/staging/23ba32d45ed2/",
  "review": {
    "reviewer": "待课件验收",
    "reviewed_at": null,
    "physics_confirmed": false
  }
}
